{
  "schema": "renderflow.page-content/v1",
  "composition_id": "fixture.raster-composition",
  "locale": "de",
  "revision": "de-1",
  "source_revision": "en-1",
  "reviewed": true,
  "direction": "ltr",
  "writing_mode": "horizontal_tb",
  "content": {
    "caption.one": "Geteilte Kunst.",
    "caption.two": "Ein klarer Schritt."
  }
}
